{"aiProposalHistory":[],"assets":[],"consentGrants":[],"currentRevisionID":"revision-ac07-basic","documentID":"document-ac07-basic","elements":[{"contentHTML":"<span>2026년 생활안전 추진계획</span>","elementID":"element-title","evidenceIDs":[],"inlineIDs":[],"kind":"heading","order":0,"styleID":"style-heading","text":"2026년 생활안전 추진계획"},{"contentHTML":"<span>지역 생활안전 취약요인을 점검한다.</span>","elementID":"element-body","evidenceIDs":[],"inlineIDs":[],"kind":"paragraph","order":1,"styleID":"style-body","text":"지역 생활안전 취약요인을 점검한다."},{"contentHTML":"<strong>[확인 필요] 통계 기준일</strong>","elementID":"element-review","evidenceIDs":[],"inlineIDs":["inline-review"],"kind":"review-marker","order":2,"styleID":"style-review","text":"[확인 필요] 통계 기준일"}],"evidenceLinks":[],"history":[{"createdAt":"2026-08-09T00:00:00Z","eventID":"history-ac07-basic","kind":"created","revisionID":"revision-ac07-basic"}],"locale":"ko-KR","providerConfigurations":[],"redoRevisionIDs":[],"revisions":[{"createdAt":"2026-08-09T00:00:00Z","elementIDs":["element-title","element-body","element-review"],"parentRevisionID":null,"revisionID":"revision-ac07-basic","snapshotElements":[],"summary":"AC-07 basic client interoperability fixture"}],"schemaVersion":1,"styles":[{"name":"제목","properties":{"font":"Apple SD Gothic Neo"},"styleID":"style-heading"},{"name":"본문","properties":{"font":"Apple SD Gothic Neo"},"styleID":"style-body"},{"name":"확인 필요","properties":{"font":"Apple SD Gothic Neo"},"styleID":"style-review"}],"templateBinding":{"checklistResults":{"출처 확인":false},"publishingAuthority":"Public Document Studio QA","requiredSections":["제목","본문"],"templateID":"compatibility-basic","version":"1.0.0"},"title":"2026년 생활안전 추진계획"}
